,comment_id,content
127,11356358541,早上收货的时候没注意看，电脑居然有被磕过的痕迹，因为已经激活了，所以不知道能不能退，问客户半天也没反应都是机器人回复。
128,11156726339,系统正在熟悉中，win 用多了，特地尝下鲜！
129,11547666115,快递很快，昨天买今天就到了，原装没开封，还需要适应一段时间，就是现在的MacBook Pro接口太少了还得额外买转接线
130,11347257088,挺好的，就是装windows 系统有点热，苹果系统没毛病，之前买了一台27寸的一体机一直也用着
131,11390876938,"苹果本子质量没得说，但是这里还是讲一下体验吧。上一个本子是macbookpro13withretina(2015early)。15年9月购入，买了applecare,还没过保。赶上公司报销（只能报*，呜呜），决定买个新款拔草，最近秒杀活动比较给力，入手*，相当于打了88折。已按照正常节奏使用两天，平常所需工作软件主要为office三件套。几点体验，1、touchid是入手高配版的唯一理由，解锁什么的方便不少；2、新版本子比老macbookpro又薄了不少，很明显可以感觉到变轻了。3、多花*块换来的touchbar使用频率并不高，保护颈椎，平时都使用外接键盘。不过长得很炫酷呀。4、感觉新本子速度上并没有特别明显的提升，可苹果优化做的比较好，老的macbookpro还没有变卡。购买建议，1、如果你用的还是15款的macbookpro，不建议现在买，因为老版接口丰富，用着还不卡。2、如果没有专业需求，平时主要使用鼠标，预算有限，不建议购买touchbar版本。综合来看，这次买笔记本主要付钱给了信仰"
132,11586679717,很不错，从WIN转过来的，这个系统需要一些学习成本，总体还不错，颜值太高了，顺便问一下，这本是不是不用关机的呀？
133,11354711525,一个小帅哥戴个白手套，捧着盒子走进来，搞得太隆重了，不知道的还以为求婚呢。那阵仗。
134,11656619180,一直纠结买13.3还是15.4，后来用来朋友12寸的MacBook 觉得也没那么小，就买来这个13.3寸的，还是很精致的，官网查了是新的，就是键盘用起来没有那种清脆的手感，可能是不习惯吧，还在熟悉一下系统和快捷键什么的，本来还打算买个鼠标，用来这款的触控板以后，发现这么大，完全够用啊，加上手势什么的，不需要买鼠标了，算是一个惊喜吧，刚收到，以后再来追加评价
135,11359546105,很薄，很轻，就是第一次用这种系统，不会用，还在适应中，只是没想到好多的软件都需要花钱啊。又换成windows的冲动啊。
136,10925879336,十月二日入手，用了一个月，最突出的感受是外观颜值高、屏幕的显示效果超赞。按键键程很短，不过很快就能习惯，习惯之后反倒觉得键程短使得打字的速度更快。电池续航一般，日常办公（使用浏览器、文档编辑、终端）可以使用七小时，如果需要开虚拟机或者编程的IDE续航就会大大缩短。机身非常薄，重量也很轻，从2013款的13寸换成这个，明显感觉书包轻了很多。可能前代的运行速度已经很快了，所以这款使用起来并没有感觉速度上有明显的提升。如果是追求轻薄，对性能要求不高，这款非常合适。
137,11587007867,送货速度很快，尊享达，开机激活10分钟搞定，开始体验中，开始键盘不熟悉，很快上手了，安装上了xcode，沉浸编程的快乐?
138,10761361777,新手首次用Macbookpro，机身设计做工精良，是我见过的笔记本中最好的，系统虽然暂时还未完全适应，但第一感觉无论从系统UI界面和用户体验都非常优秀！还有屏幕也足够惊艳，色彩画质都不是同价位win笔记本能比的！设计师摄影师用来修图设计是个不错的选择！
139,11375516217,很好。touchbar好用。买了很喜欢。小巧方便，比我以前的xps15小了很多。没有xps15的窄边更窄。
140,11232563641,喜欢京东，无人能敌的快递速度，价格还好，看了好几家店最后还是选择京东自营，安心省心，目前一切都好，使用一段日子再来追评。
141,11109136825,京东物流是真的给力，服务态度特别好，电脑没话说，苹果的确很不错，刚上手苹果系统有点不习惯，触控板是真的没话说，特别好用，手势操作很酷，优点太多了我就不一一说了，买的时候肉痛，用的时候是真的爽，速度超快，屏幕清晰，这是孩子自己选择的，超级喜欢。
142,11461616783,mac的细节处理没得说，拆包装各个环节都为客户想到了，电脑很漂亮，建议深空灰色，轻薄易携带！物流也给力！赞??
143,11502858973,太赞了，我这个对音乐有独特爱好的人，都感觉音质很好。对于一个笔记本的格调大赞，操作方便简单。
144,11549253399,打开盒子就惊艳到了，非常美观，性能也是没话说。就是这京东的快递一到大促就不行了，有待提高。
145,11704716735,很有质感，爱不释手！ 还好没买其他品牌 送的套也很有质感，发票是电子发票，质量目前没问题，用了不到一个月
146,11446867157,犹豫了好久才买的，也用了几天才来评价，简直是一分价钱一分货，再用某某品牌六千多的电脑，简直不想用了，触控板很方便，屏幕，音质都很棒，就是做开发有些软件装起来有点费劲，还在熟悉中！用起来说非常棒，很值得入手
147,10934429070,做工没得说，性能还在熟悉中。一直犹豫是128还是256，索性都得上移动硬盘，在这个剁手的季节还是省点钱买别的用。??
148,11576220015,特意用过半个多月才来评价的，出于工作需要买的苹果。总之还不错，苹果属于大小姐类型的电脑，得好好爱护。
149,10972255784,终于还是入手了，在Apple store看了无数遍后，这次下定决心买下来了。还是很不错的，电池2次循环。
150,11421990453,感觉还是air的键盘好用，这个键盘太硬了，总体还算满意，先试试一段时间先，晚点来追评价
151,11159690557,第一次体验京东京尊达服务，服务体验还是不错的，西装革履白手套送货，但是物流速度没有标准达快，有点失望，苹果的系统和做工话不多说用过才知道炫酷。只有两个type-c接口一个插电源，就剩余一个了，需要转化扩展接头满足更多工作需求。家用一般足够了。开始你的apple之旅吧！
152,11649091446,京东的物流 苹果的品质  京东值得信赖  特别不错  京东很不错   很好
153,11663540342,送货很及时，虽然不是京尊达，但是很准时，现在用了一下，应该是正品，比专卖店便宜很多。谢谢京东
154,11294750032,考虑到需要背着外出旅行，所以最终选择了13寸，但其实15寸大屏幕使用起来更带感。店家赠送的皮套很实用，感谢！
155,11661417629,用win的，这个想必很不习惯，而且什么都不兼容，做好准备吧。如果你不考虑这些，再考虑入手吧。
156,10933413506,超级喜欢，键盘手感柔软，机体轻薄。小巧玲珑，物有所值，尤其touch bar，更是专业。
157,11587849155,一直想买啊，真的超级好看好吗！等我用一段时间来追评啊，不得不说京尊享快递服务真好啊！！哈哈哈
158,11632347248,使用不错，轻薄易携带，配置办公完全够用，装了win10双系统也非常流畅
159,11240049045,实体店看过  纠结银色和深空灰  为什么选深空灰  不同的角度  不同的颜色  变色龙  性能还要用完了评价
160,10899526419,棒棒哒，就是不知道后期会不会出现涂层脱落现象
161,10639991926,首先赞一下京东自营快递的速度真的很快，而且快递小哥态度非常好。苹果的macbook pro做工其他品牌是比不了的，包装很简洁但保护很到位，屏幕显示效果非常清晰色彩很舒服处理图片很是享受，键盘键程虽然很短但是有清脆的手感我个人很喜欢这手感，笔记本的转轴阻尼刚刚好单手可以轻松打开上盖，本子的散热效果很好。最后要说的是macbook pro13寸的重量很轻非常合适经常需要移动办公的人。
162,11467911790,电脑没问题 全新未拆封，要提的是京东的配送真的是越来越棒了，京尊达服务很酷，快递小哥黑西服白手套，专门从通州送到我这，专业的不要不要的，很好的购物体验！
163,11073074888,可以说一款MacBookpro是我30岁之前的追求，如今实现了，折服的工艺和品质，只剩下要好好工作了。
164,11604737785,用了一周才能评价的，作为一名Linux工程师，这MacOS用着真爽，续航比我手机还*
165,11079983713,第一次买MacBook，刚开始习惯了win系统，后来Macos系统还是挺流畅的，本打算买air，但是男生朋友强烈建议Pro（你们懂得，男生总是考虑一些配置什么的）。为了论文，装了win10，虚拟机运作时间长了电脑发热还是挺严重的，偶尔散热功能还会开启，不知道是给我装的虚拟机的bug还是本来就这样&hellip;&hellip;总的来说还不错，快递小哥也很给力！点赞
166,11507269936,先说快递！京东的快递是没的说的！速度！又是京尊达！更是快上加快！小哥现场一起验收的外包装！完美！买东西还是要京东自营！主要是省心！若是有什么问题！电话也好！在线客服也好！也都给你办了！
167,11615794176,不错，屏幕比air好多了，pro比air更小巧。
168,11586592462,"浓浓的苹果味，棒棒哒！这才算人生第一台笔记本电脑！
感谢京尊达的小哥，在我家楼下等了一个多小时，十分感谢！上一台联想用了五年了，换到这个Mac，挺顺畅的，没什么不适应！"
169,10546269554,机子很棒 因为薄舍弃了各种接口还是很不方便 比想象中的要重 屏幕非常棒
170,11316241806,发货速度很快的，电脑也挺好用，第一次用苹果系统，还在熟悉中
171,11080498866,现款的MacBookpor非常薄，携带方便外观好看支持京东
172,11245956470,不错，非常贴合电脑，就和苹果工厂出的一样，非常适合，赞，京东的速度非常快
173,10692382388,原来买惠普新出的envy13.3寸高配，到手后发现屏幕太小，就决定加价换mac pro。*入手，屏幕很细腻，装了双系统，win10下有时会死机、比较烫、有些办公软件不兼容会变成超小字体，外观很漂亮，总之挺喜欢的，给五星吧。
174,11304040842,蛮好的。感觉很棒，设计软件啥的我再也不会卡了屏幕颜色很棒，是我需要的
175,11554456448,一万多的电脑就有一万多的颜值，系统还不熟悉，慢慢适应吧。
176,11249409424,看视频，发热，其他还好！苹果外观确实很棒！发热有点讨厌，很热！没试充满可以看几小时的视频，后面追评！
177,11475340859,物流速度真快，快递员服务很高端呀，刚到手开机，先感受一下
178,11603535701,相信品牌，相信京东。但是得习惯一阵才能用的顺畅
179,11688163441,给我儿子买的。   他说很喜欢。  用了以后再来评论
180,11607997803,整体不错！看视频时间长了或应用打开多了有点烫
181,11236767424,买Pro可谓一波三折，2月6日拍的，说好的次日达，8日也没收到，并且物流信息显示送错站点了。8日又购了PLUS会员，又拍一个，9日送到了，东东当然没得说，送货小哥态度很好。
182,11568265554,买了之后没多久就出现这样的问题 不知道什么情况 大家有遇到过的吗
183,11419340661,目前都还很好 美中不足没有US借口 需要再买转换器
184,11545003625,很不错，送货员很好，日常办公，出差带着也方便
185,11463993672,苹果系统是好，就是有些软件不支持，装双系统了
186,11586513881,东西很好，很喜欢，和苹果的实体店完全一样，包装小巧且精致。
187,11487044995,还是银色好看，没有接口，需要自己购买。还得买个鼠标。
188,11636173108,刚到，开了。正在用，以后再来评论，先尝鲜和享受快乐吧。
189,11437127568,开发用，偶尔修修图，台式机不方便移动办公。
190,10890409236,拆快递的时候超激动的 果然很薄 外观很好看 显色也很好 键盘的亮度也会随着环境光亮的恰到好处 速度也是没话说（但是 一定有但是 打开keyshot渲图速度有点慢 声音也很大 温度升的也很快 电量降的也超快的）其余都很好 充电的时候 手轻轻放在上面 会有轻微震动感 向电流一样 之后看网上说 二插充电器换成三插的就可以了 等我的三插充电器到了再来追评 总的来说 还是值得入手的
191,11364522583,内存小，运行快，是新机子，比实体店便宜一千块
192,11232262056,苹果电脑的激活时间一直是很头疼的问题，也不纠结了，通过各种手段判断是新机，循环通电3次，屏幕无漏光，用一段时间后再来追评
193,11474290642,一直在纠结买MacBook Pro还是thinkpad x280，去店里对比过，win10系统也是用起来有点变扭，pro的设计确实不错，单手开盖很棒，屏幕真的是很惊艳，无敌手，只是系统需要熟悉，充电的时候还是有点发热，不过在正常范围内，能接受，续航还没来的急体验，京东快递很好
194,11563966110,特意用了好久才过来评价，这个价格买到比美国代购都便宜了，怎么说呢，续航时间有点短。不知道是不是我做图没设置好，有时候会卡，续航是大问题。运输包装啥的就不说了。总得来说还不错
195,11457227773,一次很满意的购物，京东一直形象还不错
196,11322266793,震撼，第一次用苹果笔记本，13寸的pro。1、充电时候会震动，轻微的。2、键盘用起来感觉一般般吧，但笔记本都差不多，办公也没啥问题。3、触摸板真真是太牛了，不多说，去实体店体验一下就晓得了还在摸索阶段。基本可以告别外接鼠标?。4、touchbar只是眼前一亮，普通人用感触不是很大。5、喜欢WPS，但这回只能下office了，找的破解版，花了*大洋。先说这么多，才入手没几天
197,11443322677,2018年五一假期，给自己买了一份大礼，很兴奋！第一次用苹果笔记本，期待给我的工作和学习创造更大的便捷与价值！之前的某某电脑用了5年，太大太重了，不适应我目前工作经常出差了。拥抱苹果pro！让未来的自己成长得更好！@80后。
198,11580818370,太高端了 喜欢～设计狗一直用macbook的～
199,11563048006,苹果电脑就是好用，第四台了
200,11239032202,很好价格太贵了但是确实很轻很薄特别喜欢音质
201,11558408710,收到很满意，大小正合适，喜欢，发货速度也很快.
202,11595524635,昨天买的今天就到了，无可挑剔，用段时间再说吧
203,11000452087,不错很好，一直苹果的电脑。这款除了电池太不经用。
204,11568636530,电脑购买日期显示是5.3日，懒得去计较那些了
205,10976162023,漂亮 实用 性能好 逼格高 ￥8902
206,11328025962,比想象的小了点，装逼神器
207,11558448569,第一次买这么贵的电脑，买的时候好心疼，作为一名coder，还是喜欢效率工具，mac是不错的选择，装B和效率兼具，配置低了害怕卡，最终还是定了256的，512的还是太贵，哭，电池循环两次，官网查保修一年，都没问题，就机子来说，颜值很高，很薄，键盘键程点，感觉在敲桌子，笑，本人要求不高忽略，没有了可以亮的苹果灯，装b指数减半，笑...，谈谈touchbar，个人觉得，用处并不大，我几乎不用，用的最多的就是指纹解锁啦，装B指数+1，额..，大概就说这么多，感觉写的像是评测，笑cry.....，快递，emmmm，灰灰常快！
208,11444802417,经典银色 速度超快 超级喜欢
209,10955936305,京东服务很好！包装完好，无拆封痕迹。拿到第一时间就开封了，包装也很严密。打开检查了看，正品，值得信赖。激活icould步骤也很简单，无复杂。这是初期体验，以后用的怎么样在回来
