,comment_id,content
52,11372622006,客服服务挺好的，出了点小差错。不过问题不大，东西还可以。另外京准达就有点无语，算了，看在客服mm一直耐心解答问题上，也还好
53,10523273910,东西很漂亮，先使用看看哈
54,10987946399,双十一前剁手10288元到手的128G、初次上手Mac OS 系统和Windows还是有些差别、软件没有后者丰富、Windows可能是目前市面上最强是生产力是工具这个应该没毛病、使用过之后才知道灵活性没有Windows强、简单办公以及娱乐当然不成问题、移动便携方面有优势、这个电脑是为特定人群定制的、买它的人也认同它的价值、说得好听点是信仰、就算没那么好用也得忍着、毕竟都买了、这种感觉就像你交了一个异性朋友、乍一看颜值还行、处久了才发现对方那方面不行、但奔着奔着目地去、那方面不行这可如何是好？愁死人了于是反过来安慰自己毕竟对方颜值还行、偶尔还能装个牌面、这样也就释然了。一个月下来心酸的使用体验
55,11126222811,外观 性能不用说了！主要提一下京尊达，这服务太好了！专车配送，西装革履＋白手套 用手托着！
56,11374980875,电脑很快，很流畅，屏幕很棒！分辨率超高！无坏点，只是刚开机电源循环次数就有5次，客服解释说出厂测试，属于正常范围，总之电脑用起来很不错！
57,11443509473,"在京东买成钻石了已经，这次真都想给个零星。
第一次的本出现了花屏（看视频/开盖），当时由于手头工作较忙在单位用win机器做开发，使用该mac的频率很低，确认花屏的时候已经到了购买后第15天，致电京东告知我要么返回京东做7-15天检测，要么去本地苹果售后做检测，由于就要出差外地正是用本的时候，就在本地售后做的检测，坐标石家庄东方大厦，这是一家Apple Premium（比较优质）的售后，拿去检测一天答曰一切正常，没办法只好返回京东检测，好在一周左右后给我换了。
担心的还是发生了，如果说第一次是小概率事件，是我中奖，那么第二次真的无法接受，底面拆机接缝处的小痕迹，左侧印象细微的磕痕我都可以说服自己这是无所谓的事，但是使用一个半小时死机什么鬼？（只打开chrome的情况下），第二天F11（音量减小键）连击，看视频中自动静音，自动最大音什么鬼？
基于此我申请了退货，但京东的几个客服反复以强硬的态度告诉我依然两个选择，要么去售后检测，要么返回京东7-15天的检测。
至此距我第一次购买已经一个月了，耽误时间的什么就不说了，真是被这事恶心到了。
是的，京东是大厂，就给你发次品你能咋地，都是间歇性都奇"
58,11588258517,整体而言，非常棒！京东非常给力，包装足见成熟。绝对是正品。一年前改用苹果电脑MacBookpro，自此觉得其他电脑如粪土。这次换心，感觉如下1. 接口问题，完全改变了之前的接口，统一了。个人觉得有优有缺。短期看，不另买新线没办法给苹果手机充电，没法连接优盘硬盘，不爽；长期看，标准统一是趋势，也是优势。2. 电源线与电脑接口退步了。之前直接磁力吸附，特爽特方便，现在需要插进去，不爽。3. 速度有进步。之前已经很快，现在更精进一步，都成东方不败啦！4. 触控板更牛，之前虽然好用，但处理大规模word文稿又没鼠标时捉襟见肘。现在加大触控板，这一小瑕疵也解决了。不是针对谁，电脑中除了这个触控板和thinkpad的小红帽，其余皆垃圾。5. 键盘牛上天了，特别好用！6. &hellip;&hellip; 后面还回来补充
59,10935738569,这是一次不得已的升级，所获得的体验也是MacBook Pro中最底层的。但是2017款MacBook Pro还是给我带来了巨大的惊喜，一方面延续了固有的优秀试用体验，另一方面在屏幕、触控板上的提升是能够让你愿意彻底抛弃原有的设备的。也有一些方面的改变，比如键盘、接口，需要适应。
60,11545443820,买了个带bar的pro，主要用于出差办公编辑Excel文件。以前没接触过Mac，买来之后感觉并没有想象中的那么好，可能期望值太高，也或许本人不懂Mac吧。第一个买来就有点问题，后来京东爽快地给换了一个新的。office Excel的mac版用起来真心不好用，经常各种莫名其妙的问题出现，还偶尔程序卡死（但不死机）。touch bar对于我没多大用处，基本摆设了。整体来说，Mac除了轻便，其他感觉还是一般般。
61,11491826064,第一次在京东买这样贵重物品！果然没有让我失望～前一天下午下单，第二天上午就收到了！激动得不要不要的～拆开包裹，果然高端大气上档次！哈哈！暂时没有发现有任何问题，看来要慢慢研究研究，第一次用苹果的本！
62,11373966431,MacBook收到几天了，从打开来看到的第一眼，就爱不释手。做工是非常好，键盘打字的感觉也是特别棒。中间触摸板太强大了，基本上不用鼠标就可以完成页面切换了。京东上的价格比实体店便宜了*块钱。五星好评！
63,11558215222,"买来送妹子的，希望能提升一下她工作的乐趣！在体验店用了好多年苹果电脑的我当打开新电脑居然不会用，?，什么都找不到，事实证明体验店真就只能体验一下！
对于这电脑，屏幕很出色，比我自己用的好很多，很适合观看视频和图像处理，音响效果也不错。启动速度非常快，居然比我手机还快！
不足之处在于，机器太棱角分明了，有点硌手。就不能来点圆角处理一下吗？我这普通包估计来回装几次就坏了！"
64,11035344783,不愧为颜值担当，比起一贯的银色机，灰色显得低调奢华有内涵，对于一个苹果电脑小白来说，只要是玩过n年ios的系统，上手也是很容易的，但是因为工作需要好多软件不是app没有就是收费昂贵，最后不得不选择了虚拟机?，找对商家很便宜就可以搞定，而且新版切换起来也是相当方便，免得别人说俺拿着苹果笔记本却操作着win系统特别low，装逼的时候咱就用mac，啦啦啦你能把我怎样?。特别注明一下，记得下单的时候同时把鼠标和ty-c转换器也一起买了，不然用一半发现挖槽没法链接u盘，然后等一天快递小哥又会来给你送一下，等连上了u盘又发现，挖槽我还需要一个蓝牙鼠标，总之如果不是画图的话苹果鼠标还是不太习惯。说实话mac的系统用起来真是方便可爱，触摸板也是相当的功能强大，意外的发现双十一搞的锤子手机的充电器还能充电脑?
65,11218552652,略有缺点，总体评价还行。
66,11266495831,宝贝到了，用了很多天才来评价，真的好用，而且比实体店便宜?功能很多，就是好用
67,11226846610,非常不错，相信京东，品质无与伦比，强烈推荐给大家！
68,11358067694,很好用(??)超级好用，一直想买，超级喜欢哇哇哇
69,11178234608,电脑非常喜欢，我觉得深灰色的颜色非常适合小女生啊，哈哈！很酷很酷！关键是小哥哥开车穿西装，打领带，白手套送货上门的哦！不错不错！非常不错啦！
70,11462974487,用了一段时间啦，现在来评价下吧。苹果?的做工真的没的说，打开一瞬间被工艺惊艳到了，颜色漂亮外观大气性能给力。虽然装了双系统但会慢慢适应ios系统，觉得还是原生态系统好用。影音效果超级给力，颜色艳丽，音响效果很好，就是暂时还没买移动硬盘哈哈，准备入手啦。买的时候很肉疼纠结，好在女票对我说:现在不买以后更舍不得买了?感谢我女票。???
71,11251638310,京东的京尊达非常给力，快递小哥态度特别好，另外电脑包装到位，当然，关键是电脑，pro的确名不虚传，小巧，系统流畅，一点也不后悔多下了血本买了touch bar的，一二五八八到手，实际尺寸比13.3英寸的略小。希望给大家一个参考。
72,11242313115,搞活动买的挺便宜的   店里11588   很好
73,11137969618,收到了，就是不错，非常喜欢，在安装相关软件
74,11366153945,很快就收到货了，机子没啥问题，本本也超美的，运行速度也不错
75,11154312261,速度很快，一天了就收到宝贝了！开始在官网一直查不到保修期，今天早上终于查到了，居然是英文版的，哈哈哈！本本真的好棒，感觉就是艺术品，显示效果一级棒！但是真心觉得macbook pro里面的app实在太少了，看来真的只能拿来上网，办公还是得普通笔记本！不过还是很开心，就当自己的新年礼物啦！
76,11224341806,"之前在京东买过很多大件，也买过电脑但是mac是第一次，原因呢是觉得第一比其他地方还是要优惠一些，第二呢京东品质还是有保障的毕竟是大的电商，第三呢则是运输速度很快。基本上是第二天就到了。对于贵重物品还有专门的验证码、保证能够顺利送达到客户手里，送到的时候包装有些许破损，但是在送货员的共同开启下，里面的没有问题。
到家打开了之后发现，是熟悉的苹果包装，简洁而又精致，立刻拆包装，是原装的正品，第一次启动，电池循环次数为0。屏幕很棒，续航能够有8个小时左右、因为定位于移动工作电脑和生产工具，基本上也不会有运行大型游戏的可能，因此很满意
mac的系统之前没有用过，所以有些不熟悉，很多耳熟能详的快捷方式也不怎么适用于新系统，不过熟悉了是真心的很顺畅好用，还在持续熟悉中间，希望能够发挥出很大的作用。"
77,11101473813,尊享达送货上门，昨天体验了一天来写评论。太棒了！超赞！还能免费上wai wang，本本做工细节一流，也墙裂推荐带bar的，就是**比这便宜2k，有点不舒服。
78,11325285168,这质感真的不一样的，穿西装的小哥送过来的，还帮我拆箱子什么的，早上订的下午就到了，完好无损没有被拆开过或者动过的痕迹，送的包还可以，具体用一段时间之后再做评价
79,10812679802,完美，电脑音质特别好，除了买的时候，心在颤抖
80,11276545447,颜值很高，用起来非常流畅的
81,11396680395,还可以吧，用来做量化编程的，希望一切都好
82,11204302103,经验，需要熟悉一下，用来看视频，没毛病，107九九入手，早买早享受。
83,10938997450,大概是因为MacBook Pro的外观吸引了我再加上它那独有的Touch Bar让一切都变得更便捷，它的价格一直让我望而止步但还是抵触不了我想拥有它的热情?。最后以20069的价格拿下了15.4的512G版本。充电循环??2次、SSD固态硬盘容量剩余500GB、充电?很快续航能力一般。如果想买的朋友建议不要装windows系统，你可以直接购入win本。这款电脑适合学生以及学计算机专业、广告专业、音乐等领域的专业人士，买来看电视玩玩游戏简直就是浪费，你可以买一个iPad pro10.5或12.9的玩着比这个舒服，再加上工作处理也不错带着上课这些，如果有钱也为无所谓，直接购入趁现在便宜Apple Store教育商店都没有京东便宜。装一套wps要1998&yen;太贵了！适配软件太少！（感觉每次买到苹果的产品都喜欢闻一下新新的味道，这是癖好）哈哈哈?
84,11551094619,纠结了很久还是将15年买的Air换了，果然没有令我失望，操作非常流畅！非常适合轻度办公，音质好到飞起，比Air好用太多了，尤其是完全可以脱离鼠标操作了，最后618的的价格真的超级实惠了。买台电脑而已嘛，用不了那么纠结的，喜欢就好，合适就好。电子产品本身就是用来工作赚钱的工具。2-3年更新一回是很有必要的！
85,11292512307,2月6日下单，次日达，保修日期至2019.2.6，开封的那一瞬间真是爽呐～外观圆润，超薄，只是办公软件和ps不太方便，仅作消遣娱乐用不错，也没配鼠标，工作还是用上班时间用pc电脑办吧哦吼吼
86,11707707262,本子买在618以后，特意用了一段时间才来评价，说一下个人感受吧。设计行业从业者，一直想买个轻薄本，汇报方案、简单调调图、可以看平面图就够了，要求很简单。为什么最后选了它，也很简单～逼格和系统，简单省心。买之前也纠结过要不要等等新款，后来想想自己的用途，性能高低对我没什么意义也就释然了。裸机一枚，没贴膜没包壳，就一个送的内胆，公文包一放完事。最后说一下，京东快递很好，快递小哥很赞！
87,11013664281,用了几天才来评论的，用起来很快，外观也很好，就是不知道是不是因为自己重度使用，电池消耗的很快，在过一段时间在看看是怎样的
88,11070583632,超级棒！看了一个多月，终于在双十二买啦，还在熟悉当中～不过真的超级超级喜欢，爱死啦！为了它，得吃几个月的土啦?
89,10925377451,第一次买这么贵的电脑 但是还是物超所值的 感觉还是macos系统好用 那些玩游戏的 劝你还是买Windows系统吧
90,10950945507,显示屏幕比之前买的air好太多，触摸板手感极佳，赶紧买吧，早用早享福。到手价不到约9k.
91,11202772499,昨天下单，很快收到货，大雪天辛苦快递小哥了，年货节*秒杀，现在的笔记本是大一入学买的，到现在9年了，也到年限了。一直留意这款电脑，工作有积蓄了当作新年礼物了。电脑很漂亮，显示效果秒杀其他型号，就是刚开始用，还不是特别喜欢，慢慢来会好的，个人文档写的很多，需要家学校两地跑，重度Office使用者，电脑很便携，希望能带来更高的工作体验和效率，2018加油加油！
92,11198097598,惊艳！颜值整体设计没得说，真材实料，Retina显示屏真棒?7代酷睿CPU，电池也挺耐用的，至于发热个人觉得还可以，完全能接受，音质完美，Mac OS很流畅，就是用惯了Windows，还得习惯习惯，相信京东自营，物流没得说，快，推荐?
93,11722434068,以前没注意京准达服务，买这个下单时候，还必须要我选送货时间，遂生厌。早上8.30分刚把衣服穿上，电话就来了，可能我离大库进吧，小哥一口服务腔远比之前三轮小哥更专业，到了一看，小哥开一辆黑色喷有京东logo的帝豪，着实让人惊讶不已，心下暗道：京东这么牛了现在？！毕竟平时都开蹦蹦。上前表明身份，小哥打开后备箱，一摞儿黑红相间的盒子显现出来，最上面的盒子同样印有京东logo。只见小哥顺手拿了最上面盒子问道：是否打开验货？答：不必了。小哥仍四下展示示意包装完好，并道：如有破损仍可联系云云。收起盒子向家中走去，途经一早食店，稍作停留并吃了两个包子，一个茶叶蛋，还有一碗稀饭。酒足饭饱，扫了店家二维码结账，不敢耽搁，便继续向家中疾行，不消片刻既至家中。急急打开盒子，只见黑盒子封口处有京东奢侈品封签，撕掉并拿去黑色盒子，里面仍套有稍小一圈的普通纸盒，继续打开，电脑的自带包装这才漏出庐山真面目，不消多说，打开包装，翻盖，未及按下电源按钮，屏幕竟然直接亮了？好在官网查询后没什么问题。使用后感觉发热明显，续航不足 ，除了配置高点，屏幕好点，还不如15款的air，继续观察吧
94,10743797618,很不错 特别的舒服 果然一万多的东西就是不一样 以前还没有想过要换这么好的电脑 感觉自己一天游手好闲的 给我也是浪费了 哈哈哈。
95,11632450956,声音真的很棒 ，比iPad pro还要有感觉，?东现在学乖了，618当天的价格也和6月1至6月17的最低价一样了，估计是怕保价的太多吧！618没买的童鞋可以在观望一下 wwdc没出新款，9月份肯定要出新款的 ，可能有8代6核的cpu的.
96,11093939396,研究好几个月啦，单位电脑太卡，干活不方便，本子不错，头一回买本子，就买个最好滴，用的不错，2??万0??8??8??到手，用的就是爽，这回上班也不愁啦，
97,11384230288,包装很简洁，不过足够了~机子完美啊！老婆完全是冲着颜值买了这款，性能大大超过需求~用起来心情好就超值~老婆高兴就好~
98,11518615802,这是我网上买过最贵的单品了，非常爱不释手，怕划了，还买了一堆保护措施，配上保护膜鼠标外壳什么的又花了一千来块，再配个超级棒的鼠标，个人觉得这个鼠标比苹果鼠标好用，希望我的完美维护，几年后包膜撕下来还跟新的一样！这个电脑非常好用，发货超级快，我半夜下看到19500的单，竟然早上起来就送到了！京东真是大神啊！
99,11654272496,买后降价了，屏幕太小，想买大点的15.4，慢慢习惯系统中，很多不一样............................................................................
100,10839837434,给媳妇买的办公本，媳妇喜欢拍照，修图，平时也就看看电影，用下office应该是满足要求，蓝牙连不上手机是因为手机系统没升级，其余的还在摸索，触摸板很方便，基本可以脱离鼠标，话说，颜值就是王道！
101,11647709915,苹果的东西没得说，工艺品级设计，touch bar的加入，操作更方便快捷（美中不足的是耗电有点厉害，待机时间较老款要少30%甚至还多），新pro键盘更薄，手感更舒服，长期打字都不觉得很累，顺便表扬下东东，送货速度杠杠的！??
102,11435353703,京东快递一如既往的快，基本就是次日达；电脑包裹得比较好，应该是正品原封，苹果的工业设计确实不错，有touch ID，触控条功能很nice；另外真的如大家所说，在视频程序里播放视频苹果有免广告功能，苹果电脑独有的福利！
103,11487327887,五月14号买的。也就是昨天买的。盒子包装所有东西齐全我对电脑一窍不通本以为买来可以自己学可是太难了没耐心~
104,11661002853,还是挺可以的，苹果系统很不错，用起来很爽，不过建议不要买128的，真的不够用，还有就是QQ和微信只能同时登录1个，不能登录多个，这个是系统的限制，最后说一下，触控板，触控手势真的很好用哈哈。
105,11261201375,电池循环一次，屏幕会把我的眼镜惯坏的！除了风扇声音大了点！其他都很不错！开始会担心OS系统不好用，一个小时后决定不装双系统，OS很流畅！音响一级棒！真的是一分价钱一分货，我应该多加点钱买大内存的！
106,11077768887,双12买的，第一台mac，刚开始用还不太习惯，用了几天就会慢慢习惯了，分辨率很高很清晰，用腾讯或者爱奇艺看视频都没有~，这是mac的一大亮点吧，哈哈哈，总之用起来很好，建议不要拿来玩游戏，毕竟拿来办公比较好，推荐一个小米xiao.mi的外接口，既可以插网线，还有2个U-S-B3.0，一个VGA，一个充电孔，非常赞，比原装的要好多很，还便宜。
107,11312173614,"东西不错，没有划痕，查了日期，全新未激活，苹果的原封双层包装，有发票选的纸质，收到还是电子版的，不纠结了！关于产品，针对苹果品牌的，一、你做个笔记本，居然弄的typc口,配套接口少，要转换接口不方便！第二、接口转换也就算了，你不带bar的，就左边两个typec口，一个电源占着了，说不好听的，要么就买一转多的头，要不，同时都不能插2种设备！最后:很多typec转u**口都会和苹果无线网冲突，买几十的typec转u**，不带bar的，我说下冲突是99%的可能性，机器矫情的很，除非买苹果官方的typec转u**，就一个口，139好贵，而且官网选项发票居然有电子收据，你以为那是电子发票就错了，那是收据，你不主动找他们，他们都不补开，我给带税的钱，而且不在乎价格贵，你却把税省下了。人才！居然苹果官网有电子收据和普通发票二选一的选项！"
108,11069052413,双十二购的，便宜一点，凌晨拍的，下午就到了，京东就是快。电脑棒棒哒，就是不太会用，appid一直登录不上去，折腾了半天，打客服电话，很给力的帮忙解决了。为客服点个赞！第一次用mac，慢慢习惯吧！对于程序员应该很实用。
109,11670913617,"暗恋了很久的macbook 拿快递的时候激动极了
真机很美很轻 电池循环了3次 也在官网查了序列号
然后就开始逐步熟悉系统 跟windows很不一样 需要习惯一阵子 期待后续使用!"
110,11455372730,给力，在air和这款之间徘徊好久，最后选了pro，一天到手，到手后果然没有失望，还是一分价钱一分货，一定要在自己的能力范围内买最好的，最起码能用好久，心里还会很开心哈哈，总之不会出错，预算足够必须推荐这款。
111,11412554255,"基本：新机器无疑，保修扎实！
优点：完全无需使用鼠标啦，解放啦！材料使用一级棒！刚打开看到如此之薄，着实把我惊到了，也是第一次使用苹果笔记本！屏幕相当优秀，就是冲这个来的！本来打算Thinkpad12.5寸那个系列，但屏幕实在不行，尺寸又小，肯定亏眼睛，买了Mac pro！
缺点：键盘还不是很适应！感觉电量没描述那么牛！"
112,11135755339,好吧    还可以   就是内存买小了   才8个g   开发完全不够用   有时候会卡   其他的还好
113,11078128468,全新正品，很精致，touchbar很好用，随不同应用出现不同界面很人性化，省心省事，加入了指纹识别更快捷。到手以后查询了电话支持3个月，保修期一年，电池循环次数3。京东送货超快，凌晨下单，傍晚就送到家了?
114,11141805473,不错不错，鸟抢换换炮了，键盘还需要熟悉下，按下去有点不习惯，接口买了小米的转接头，省了一大笔银子，总之赞赞赞，用的京东京尊大配送，服务超好，说几点就几点，五星好评！
115,11387031962,看到13999，果断下单，凌晨下单，今天下午四点钟就收到，很赞！回来仔细检查了下，右边扬声器有点划痕，但是能接受。由于是大件了，买回来没有急着拆封，而是赶紧付费查了下，果然没有失望，全新没有一丁点问题。拆封后第一时间就是更新系统，MacOs习惯了之后，可以完全抛弃Windows！一百个赞！
116,10829286804,屏幕好清晰，启动也更快，中秋节买的优惠了很多，比官网便宜太多了，全色域p-3果然不是盖的
117,11336468333,用着很好，衡量3.8，618，双11，还有秒杀价格，这个价格很合适。3.8妇女节*元到手。虽然下单后过了几分钟降价*元为*元。也算很值了。如果在这个价格左右就赶紧下单吧！
118,11272632019,纠结了好半天，还是买了pro，虽然很多人都说用处不大，但还是抵挡不住它对我的诱惑，外型完美，超酷！反应敏捷，用起来心情舒畅！完全没有卡顿带给我的无奈感&hellip;&hellip;真心喜欢！这次还见识了京尊达的服务，送货迅速、衣冠楚楚、彬彬有礼，超赞！喜欢京东！信赖京东！
119,11266924811,电脑挺好的，查了序列号是全新的，就是有一处有点刮痕，不知道为什么，暂且不追究，屏幕 上有点脏东西，另外 快递是真的慢，我还是挺失望，没有按时送到，快递小哥 语气也不是很好
120,11541996881,用了几天才来评价的呢～太棒了，回来就测了下序列号～正品呀～嘿嘿，大爱京东，大爱果果～一定要买最大屏的～看视频，工作体验太舒服了，之前有个11寸的～眼睛快累瞎了&hellip;&hellip;
121,11347684781,还是很不错的
122,11232212942,赶上了8990的末班车，第二天一看，深灰色的已经9880了。及时下手真的是对的。
123,11392686529,没有传说中的正装白手套专人送货，瓦楞纸箱有破损，仔细检查后打开第一层，内部的出厂包装完好，电脑本身没有任何问题，开机设置升级一切顺利。具体到电脑本身，建议买家多在苹果线下商店体验几次后再决定选择购买，使用一天后刚好碰上新发布的OS系统升级，果断升起来。总之一分钱一分货，值得购买！
124,11619053613,618期间抢到的，真心划算，朋友做苹果生意都给不到这样的价，还有30天保价服务，相当到位了，现在家用电器数码产品统统京东包了，产品好，服务好，速度快，多快好省相当贴切
125,11358122601,17款Macbook pro质感超棒，做工更精细，视网膜屏真的很惊艳，键盘进程不如老款但还算舒服，不过未配备通用接口、及扩展口，而是用2个type -c接口替代，似乎太超前些了吧。总体很棒。这次JD物流配终于及时了服务这算到位，赞一个。
126,11077195500,比双十一贵，14298入手，mbar本来想着没什么用的，用起来还是挺方便的，超出预期
